,angry,crawled_utctime,created_time,haha,id,like,love,message,owner_id,sad,type
0,1,2018-03-22 08:42:15.501705,2017-04-30 14:37:52+00:00,5,114731331886956_1773709709322435,562,42,"Admin .S: nghĩ một nước Việt Nam dân chủ trong tương lai sẽ có quốc kỳ không phải là một trong hai lá cờ - cờ đỏ sao vàng và cờ vàng ba sọc đỏ, nhưng admin .S: hy vọng bài hát Việt Nam! Việt Nam!  sẽ là quốc ca.

Việt Nam không đòi xương máu 
Việt Nam kêu gọi thương nhau 
Việt Nam đi xây đắp yên vui dài lâu 
Việt Nam trên đường tương lai, 
Lửa thiêng soi toàn thế giới 
Việt Nam ta nguyện tranh đấu cho đời
Tình yêu đây là khí giới, 
Tình thương đem về muôn nơi 
Việt Nam đây tiếng nói đi xây tình người 
Việt Nam! Việt Nam! 
Việt Nam quê hương đất nước sáng ngời 
Việt Nam! Việt Nam! Việt Nam muôn đời",114731331886956,4,video
1,0,2018-03-22 08:42:15.501705,2017-04-30 09:00:00+00:00,1,114731331886956_1773053122721427,169,7,"30-4-1975, NGÀY QUỐC HẬN ? AI THẮNG, AI BẠI, VÌ SAO ?
(Câu chuyện được kể từ 1 nhân chứng sống của bên thua cuộc)

http://thongluan-rdp.org/di-n-dan/item/1951-30-4-1975-ngay-qu-c-h-n-ai-th-ng-ai-b-i-vi-sao",114731331886956,7,video
2,9,2018-03-22 08:42:15.501705,2017-04-30 05:30:00+00:00,596,114731331886956_1773055362721203,1449,36,"Kính gửi lời xin lỗi đến toàn thể người dân Việt Nam lẫn đồng bào ruột dài ngàn dặm... :3 :3 :3

#DepBay
fb Anh Cả
[Koala]",114731331886956,6,video
3,6,2018-03-22 08:42:15.501705,2017-04-30 05:00:00+00:00,8,114731331886956_1772729196087153,731,13,"KHI ĐÀN BÒ VÀO THÀNH PHỐ 

st",114731331886956,103,video
4,1,2018-03-22 08:42:15.501705,2017-04-30 04:20:00+00:00,66,114731331886956_1773045262722213,303,9,"THẦN CHẾT & CHIẾC DÉP

Video được sản xuất trên tinh thần vui vẻ, hài hước và đương nhiên có gắn liền với một sự kiện gần đây là việc xin lỗi tử tù Hàn Đức Long, phó Chánh án TAND cấp cao tại Hà Nội bị ném dép vào mặt ngày 25.04.2017 tại Bắc Giang.

Video không đả kích bất cứ cá nhân, tổ chức nào nên mọi comment khiếm nhã sẽ bị xóa ngay lập tức. Nhân tiện, xin nhắc nhở mọi người đang là bạn bè của tôi, 30.04 KHÔNG PHẢI LÀ NGÀY LỄ !!!

fb Hoàng Thành 
[Koala]",114731331886956,1,video
5,2,2018-03-22 08:42:15.501705,2017-04-30 04:00:00+00:00,4,114731331886956_1772731746086898,692,18,"Nhà văn Dương Thu Hương: Cộng Sản đày ải người dân như chó như bò !!!

st
Kili",114731331886956,29,video
6,9,2018-03-22 08:42:15.501705,2017-04-30 03:20:00+00:00,1,114731331886956_1773009472725792,954,59,"[Nóng] 
Giới trẻ Gx. Phú Vinh lên tiếng vì môi trường , phản đối Formosa !!!

fb Tuấn Đen",114731331886956,5,video
7,8,2018-03-22 08:42:15.501705,2017-04-30 01:27:00+00:00,53,114731331886956_1772730596087013,2347,152,"Cảm nghĩ của nhà văn Dương Thu Hương về ngày 30/4

st",114731331886956,26,video
8,7,2018-03-22 08:42:15.501705,2017-04-29 13:29:00+00:00,6,114731331886956_1771946312832108,1376,111,"Tổng thống Ngô Đình Diệm thăm dân bị lụt.
.S:",114731331886956,33,video
9,4,2018-03-22 08:42:15.501705,2017-04-28 17:43:46+00:00,28,114731331886956_1771400982886641,717,30,"""Thật ra, khi dán cái nhãn ""ngụy"" lên miền Nam, ""Đảng và Nhà Nước"" muốn nhân dân ""chủ yếu là nhân dân miền Bắc"" hiểu theo định nghĩa ""ngụy"" là giả, ""giả nhân giả nghĩa, giả đạo đức, giả yêu nước thương dân, ""ngụy"" là đoạt của người ta mà nói là của mình, là bịp, là láo, là phiến loạn... 

Về sau, khi nhân dân cả hai miền đều... mở mắt, tiếng ""ngụy"" ít thấy dùng tới. Nhưng bây giờ thì mọi người đều nhận ra ai mới đúng là ngụy. Lớp ngụy trang bị rơi xuống, những ngụy ngôn bị vạch trần, thì chân tướng ngụy lòi ra rõ rệt, đến người mù cũng phải thấy!""

* trích NGỤY - truyện của Tiểu Tử 
Admin .S: mời các bạn nghe đọc truyện đêm khuya:",114731331886956,11,video
10,3,2018-03-22 08:42:15.501705,2017-04-28 16:59:27+00:00,50,114731331886956_1771327662893973,558,10,"Giá lợn hơi 17.000 đồng/kg 
chưa bằng 1/2 chi phí sản xuất 40.000 đồng/kg.
Tiếc cái ông Tổng Bí thư trồng cây gì nuôi con gì quá :((
.S:",114731331886956,43,video
11,442,2018-03-22 08:42:15.501705,2017-04-28 00:00:00+00:00,11,114731331886956_1769706503056089,1900,45,"Bạn muốn biết về sự tra tấn man rợ của ngục tù XHCN? 

Mời bạn cùng nghe người tử tù oan Hàn Đức Long kể lại 11 năm khổ sai cùng những đòn tra tấn dã man từ CA

Clip : VTC1

[K]",114731331886956,129,video
12,229,2018-03-22 08:42:15.501705,2017-04-27 12:33:00+00:00,6,114731331886956_1769552066404866,2430,89,"[CHẾT ĐÓI, THỊT NGƯỜI, THUỐC PHIỆN VÀ VŨ KHÍ 
Nguyên soái Kim Ủn muôn năm (fb Ngô Hóa) ]

Các bạn có muốn biết cuộc sống của người dân Bắc Hàn dưới chế độ Cộng Sản của nhà họ Kim vào thập niên 90 (thời nạn đói hoành hành) ra sao thì hãy xem clip này ! Tôi đã cố gắng dịch ra phụ đề tiếng Việt cho những người không nghe được tiếng Anh,  nếu ai thấy dịch sai xin cáo lỗi trước ! Cám ơn các bạn ;)

fb Kevin Pham 
Kili",114731331886956,547,video
13,16,2018-03-22 08:42:15.501705,2017-04-27 10:00:00+00:00,199,114731331886956_1769549929738413,1441,13,"[GIA LAI THẤT THỦ]
Đến Gia Lai đất cao nguyên mà cũng thất thủ nữa thì cái xã hội thiên đường VN không biết nên diễn tả ra sao :( 

Video: fb Nguyễn Cường 
Kili",114731331886956,57,video
14,2,2018-03-22 08:42:15.501705,2017-04-27 08:30:00+00:00,63,114731331886956_1769554249737981,841,32,"[KHI CSCĐ CHẠY NHƯ VỊT]
Cộng sản chỉ thối lui khi người dân đồng lòng ...",114731331886956,1,video
15,3,2018-03-22 08:42:15.501705,2017-04-27 02:00:00+00:00,6,114731331886956_1768374159855990,1773,99,"Giọt Nước Mắt Cho Việt Nam 
Thuý Nga Paris By Night 

Chiến Tranh Việt Nam - dưới cái nhìn từ phía bên kia.

=A=",114731331886956,284,video
16,6,2018-03-22 08:42:15.501705,2017-04-26 08:00:00+00:00,4,114731331886956_1768356446524428,440,17,"[Âm Nhạc Với NKYN]

Chúng Đi Buôn
Sáng tác: Phan Văn Hưng

Chúng đi buôn buôn tước buôn quyền 
Chúng đi buôn cho nước đảo điên 
Chúng đi buôn buôn núi buôn non 
Buôn tủi hờn buôn cả giang sơn 

1-Chúng đi buôn buôn sắc buôn sầu 
Chúng đi buôn nước mắt lòng đau 
Chúng đi buôn thân xác xanh xao 
Buôn đời mình buôn cả thâm sâu 

Chúng đi buôn buôn bến buôn bờ 
Chúng đi buôn ánh mắt trẻ thơ 
Chúng đi buôn tiếng khóc đơn sơ 
Cho đời càng gian khổ cam go 

2-Chúng ăn vuông ăn méo ăn tròn 
Chúng ăn to ăn bé cỏn con 
Chúng ăn trên ăn dưới ăn ngang 
Cho mặc người ai thở ai than 

Chúng đi buôn giấy phép văn bằng 
Chúng đi buôn công lý (với) lòng nhân 
Chúng đi buôn buôn nghĩa buôn danh 
Buôn sự thật buôn cả lương tâm 

3-Chúng ăn chơi xương máu đồng lọai 
Chúng chơi vui trên kiếp nghèo đói 
Chúng chơi sang chơi xấu chơi oai 
Chơi như đời không còn ngày mai 

Chúng đi buôn chia chác sang giầu 
Chúng đi buôn lừa dối gạt nhau 
Chúng đi buôn cho mắt thêm sâu 
Lỗi khổ này sẽ còn bao lâu 

Rồi một mai em lên non cao 
Trông về xa núi rác ngập sầu 
Nhưng thành phố chen chúc bụi nâu 
Nơi kiếp người tranh thủ miếng đau 

Và lòng em sẽ trong xôn xao 
Tim thật chân vỡ lên nghẹn ngào 
Kẻ cùng khốn trong kiếp khổ lao 
Cũng chính là những người đồng bào ..

Admin =A= NKYN",114731331886956,64,video
17,18,2018-03-22 08:42:15.501705,2017-04-25 14:30:00+00:00,400,114731331886956_1767649319928474,1830,59,"NÉM DÉP HẠ NHỤC NỀN TƯ PHÁP VIỆT NAM

Thật không biết dùng từ nào để diễn tả nỗi nhục nhã của nền tư pháp Việt Nam hôm nay. Buổi tổ chức công khai xin lỗi tử tù Hàn Đức Long bị hàm oan hơn 11 năm trời của ngành tòa án lại đọng lại hình ảnh nổi bật: chỉ trong khoảng 1 phút ngắn ngủi đã có hơn chục chiếc dép của dân 'bay' về phía ông Trần Văn Tuân - Phó chánh án Tòa án Cấp cao tại Hà Nội!

Tôi không biết rõ trong văn hóa hành xử của người Việt mình thì hành động ném dép, ném giày có biểu hiện ý nghĩa xem thường, sỉ nhục như trong văn hóa Hồi giáo hay không?

Tòa án - thiết chế biểu tượng đại diện cho công lý - mà bị ném dép như thế có liệu khác gì con người ta bị hạ nhục bằng hình thức ném phân vào mặt? 'Thượng bất chính, hạ tắc loạn'. Trước khi trách dân hành xử lỗ mãng, hãy tự vấn xem vì sao ngày nay dân chúng chán ghét chế độ cùng với cán bộ công chức và luật pháp của chế độ ấy đến vậy?

Khi pháp luật không còn là phương tiện giúp người dân tìm kiếm công lý mà trở thành công cụ trong tay kẻ bạo quyền dùng để cai trị & đè nén dân chúng, làm lợi cho mình và phe đảng của mình, tất yếu sẽ dẫn đến hành động chống đối và bất tuân.

Muốn không còn cảnh bị dân chúng bày tỏ thái độ khinh bỉ, phải có hiến pháp chuẩn mực, luật pháp chuẩn mực. Mà muốn có những ""thượng tầng kiến trúc"" chuẩn mực này lại buộc phải cần có một nền chính trị chuẩn mực: đa nguyên, đa đảng đúng nghĩa.

Chừng nào vẫn chưa có được một thể chế Tam quyền phân lập đúng nghĩa trên đất nước này, chừng nào Tư pháp vẫn chỉ là cái ""bình hoa"" dân chủ cho Đảng dùng trang trí để mị dân và đối phó với quốc tế, việc ném dép vào mặt Tư pháp như thế này sẽ không phải là cá biệt.

---

(Video: Vietnamnet, http://vietnamnet.vn/…/toa-xin-loi-cuu-tu-tu-han-duc-long-n…).

Fb Nguyễn Hồng 

[K]",114731331886956,11,video
18,1258,2018-03-22 08:42:15.501705,2017-04-25 13:00:00+00:00,1043,114731331886956_1767560353270704,11026,361,"Ông Hàn Đức Long bị kết án tử hình oan trong một vụ án hiếp dâm, giết người năm 2005 tại Bắc Giang. Sau 11 năm bị giam giữ, ông đã được trả tự do và toà án đã kết luận ông bị kết án oan. Thủ phạm thực sự vẫn chưa bị đưa ra ánh sáng. Chiều nay, trong buổi xin lỗi công khai ông Hàn Đức Long tại Bắc Giang, rất đông người nhà của nạn nhân đã tỏ ra bức xúc và gây náo loạn bởi sau 12 năm vẫn chưa tìm ra thủ phạm. Nền tư pháp Việt Nam đã gây ra rất nhiều những oan sai cho người dân, nhiều gia đình tan nát, ly tán bởi những kẻ nắm giữ luật pháp nhưng lại luôn ngồi xổm trên luật, coi thường tính mạng, nhân phẩm, danh dự của người dân.
(fb Nguyễn Văn Phương)

Chiều nay diễn ra buổi công khai xin lỗi tử tù oan Hàn Đức Long.
Ông Hàn Đức Long ở Tân Yên- Bắc Giang bị cơ quan công an đánh đập, ép cung dã man để buộc phải nhận tội danh hiếp dâm và giết người. Sau nhiều năm kêu oan, ông đã thoát khỏi bản án tử hình.
Chiều nay diễn ra buổi công khai xin lỗi ông trong sự giận dữ của công chúng.
...
Hãy thử tưởng tượng vào 1 ngày đẹp trời, bạn đang mơ màng giấc ngủ thì CA đạp cửa xông vào và ném vào mặt bạn bản án tử hình !!!",114731331886956,189,video
19,1322,2018-03-22 08:42:15.501705,2017-04-25 08:53:38+00:00,2268,114731331886956_1767357166624356,21916,821,"Đoạn clip được quay tại khu vực Bình Chánh, tp HCM. Người quay clip cho biết đoạn đường này xe gắn máy được phép đi cả 2 làn nhưng CSGT Bình Chánh cố tình lập chốt sách nhiễu người dân nhiều lần với lỗi lấn tuyến. 

Bức xúc trước hành vi mờ ám diễn ra hàng ngày của CSGT, chủ nhân clip đã chuẩn bị sẵn camera. Kết quả, khi vừa thấy camera 2 CSGT luống cuống vội vã rời khỏi hiện trường. 

Đặc biệt, ngay khi 2 CSGT gặp ""rắc rối"", gần như lập tức xuất hiện 2 ông kẹ trong vai ""quần chúng bức xúc"" giải vây cho 2 vàng bỏ chạy. Ừ, chỉ là ""quần chúng bức xúc"" thôi nhe

[K]",114731331886956,90,video
20,185,2018-03-22 08:42:15.501705,2017-04-25 02:00:00+00:00,33,114731331886956_1766094136750659,1170,15,"Sau 30/4/1975, trình diện Sĩ Quan ""Ngụy"" chế độ VNCH.

Những nhân chứng sống vẫn còn hiện hữu trên thế gian này, khi nghe lời thuyết minh trong đoạn phim dưới đây (trích phim tài liệu: Thành Phố Lúc Rạng Đông) chắc là buồn cười lắm, mà cười ra nước mắt.

Những gì họ (khoảng 700 ngàn lính VNCH) đã trải qua như một cơn ác mộng kinh hoàng.
Thông báo sẽ đi Học Tập Cải Tạo chỉ 10 ngày theo đường lối của chính quyền cách mạng lâm thời, nhưng sau đó đã có rất nhiều người đi học còn dài hơn thời gian ở phổ thông trung học (1975 - 1990). Học tại địa phương ở các hội trường, công viên, sân banh... từ từ nâng cao thì được ra tận phương Bắc (Sài Gòn ai còn nhớ thời điểm bị chuyển ra Hàm Tân, thì 2h sáng gia đình đi thăm nuôi bằng xe than). Học không thông tư tưởng HCM, hay xui xẻo làm cho cán bộ ngứa mắt trong những ngày lao động khắc nghiệt, thì chuyện gì xảy ra cũng không lường được, trại cải tạo thì vẫn có nội qui chính thức, nhưng cán bộ thích quyết định ra hình phạt tùy theo thời tiết hơn.

Hơn 150 trại cải tạo trên lãnh thổ Việt Nam được mọc lên, biết bao nhiêu người lính ""Ngụy"" chưa ""tốt nghiệp"" nhưng phải bỏ mạng (hơn 160 ngàn) với nhiều lý do ""rất nhạy cảm"" nơi rừng thiêng nước độc (phần đông được thông báo là chết do bệnh, tai nạn). Lúc ấy đất nước ta đang còn ""khó khăn"" nên thông tin cũng rất ""hạn chế"", đến khi thân nhân vợ con khăn gói ra thăm nuôi, thì mới hay người lính ""Ngụy"" ấy đã chết cả tháng rồi. Thân xác được cuốn chiếu vùi nơi rừng sâu, may mắn lắm mới tìm ra được xương cốt, rồi cũng phải lén lút mang về trong đêm khuya không một tờ giấy chứng tử.

Mô hình Học Tập Cải Tạo này được chủ tịch HCM copy từ Liên Xô, Trung Cộng, và đã áp dụng ở miền Bắc vào năm 1954. Không phải tù đày không có trả thù đẫm máu, nhưng phải lao động khổ sai và không cho biết ngày về. Cũng từ đó mà biết bao nhiêu gia đình tan nát với nhiều nghịch cảnh khác nhau. Sài Gòn lúc bấy giờ phần lớn là những ngôi nhà không có đàn ông, rất nhiều hoàn cảnh giống như ĐỜI CÔ LỰU. Con cái đi học đi làm thì lý lịch bị đánh dấu bôi đen, bị cách mạng kỳ thị...

Tất cả đã là dĩ vãng, nhưng dư chấn vẫn còn đây, không bao giờ xóa đi được trong ký ức của nhiều người. Nó nhất định là một góc lịch sử của những gia đình được cho là thuộc thành phần ""Ngụy Quân Ngụy Quyền làm tai sai cho Đế Quốc Mỹ"".

Học Tập Cải Tạo sự thật nó ""được"" đối xử như thế nào, có phải hòa hợp dân tộc hay không thì nhân chứng vẫn còn đó, bởi thế khi nhắc đến thì xin làm ơn đừng dối trá bịp bợm, đừng tô son trét phấn lên những vết thương của Cha Ông chúng tôi, những người mà chứng tôi luôn ghi ơn và kính trọng.

Thanks.

Fb  Dung Dinh 

[K]",114731331886956,199,video
21,90,2018-03-22 08:42:15.501705,2017-04-25 01:02:00+00:00,158,114731331886956_1766779763348763,916,16,"Hăng hái giao đất mở đường,
11 NĂM CHƯA ĐÒI ĐƯỢC TIỀN ĐỀN BÙ 

Đã 11 năm qua, 165 hộ dân ở xã Đồng Thái, huyện An Dương, TP.Hải Phòng vẫn miệt mài gửi đơn, nêu ý kiến tại các cuộc họp với mong muốn nhận tiền đền bù phần đất mà họ đã hăng hái giao cho chính quyền địa phương để mở rộng đường.

http://video.thanhnien.vn/phong-su/hang-hai-giao-dat-mo-duong-11-nam-chua-doi-duoc-tien-den-bu-84143.html .S:",114731331886956,31,video
